,recipe_name,description
0,Flank Steak With Pepper Sauce & keto gratin - Recipe - Diet Doctor,"A flank steak is a versatile cut of meat with a rich, beefy flavor and a lower cost. Spiced with a pepper sauce and paired with an attractive and easy gratin of cauliflower and broccoli, the result is a nutritious, satisfying meal that you will return to time and again."
0,Low-carb Granola With Cardamom and Vanilla - Recipe - Diet Doctor,"Missing a satisfying granola on your low-carb diet? This easy recipe fits the bill: crunchy and nutty, with a taste of coconut and vanilla. Serve with a dash of cream or yogurt and a few berries. Voila - you've got breakfast, a snack or even dessert."
0,Keto Salmon & 5 Min Hollandaise - Recipe - Diet Doctor,"What a combination: seared salmon and tender crispy asparagus. So elegant, so tasty, so easy. Topped with a fast and simple hollandaise sauce, it is a simple, yet super delicious meal."
0,Kale Salad With Goat Cheese & Pomegranate — Recipe — Diet Doctor,"A beautiful winter salad is packed with flavor and nutrients. Kale is king. It's one of the most nutrient-dense foods in the world – loaded with high amounts of vitamin A, K and C. Even if pomegranate contain some carbs, they are carbs well invested."
0,#1 Keto Flourless Chocolate Cake - Recipe (Video) - Diet Doctor,"This luxurious, creamy chocolate cake is almost too easy to make but looks and tastes amazing — a rich smooth chocolate taste with a hint of salt mingled with nuts and seeds. And did we mention that it's keto too? Well, what are you waiting for?"
0,Super Easy Keto Chaffles (2g net carb) - Diet Doctor,"Keto waffles or ""chaffles"" have taken the world by a storm! This gluten-free keto chaffel recipe is made with eggs and almond flour and is the perfect base for creative toppings. Craving savory chaffles? Add ham and chives. Sweet chaffles? Add vanilla and cinnamon. The possibilities are endless."
0,Spanish Garlic Shrimp (Gambas al Ajillo) - Recipe - Diet Doctor,"Lucky for us, this popular Spanish tapas dish, Gambas al Ajillo, is perfectly suited for a keto lifestyle. Spicy and garlicky, with a touch of lemon, it shines as an appetizer as part of a Spanish party platter, along with Manchego cheese, olives, and Serrano ham."
0,Clara's delicious low-carb huevos rancheros - Recipe - Diet Doctor,"Spice it up at breakfast time with these Mexican-style eggs. Clara's version keeps it low carb and satisfying: fried eggs, a zesty tomato salsa with jalapeños and cheese, and avocado. It's a perfectly delicious way to start your day!"
0,The Best Low-Carb Beef Stroganoff & Cauli Rice — Recipe — Diet Doctor,"Beef Stroganoff has been a favorite dish, the world over, since the 19th Century. This is an updated classic Russian meal recipe with a low-carb twist: sirloin steak and cauliflower rice. Packed with flavor and freezer-friendly. Let's cook!"
0,Keto Asian Style Chicken Wings - Recipe - Diet Doctor,"Zest up your chicken wings with a tamari and garlic Asian-style marinade. Served with a bok choy sesame stir-fry and garnished with cashews, this is a simple keto meal that beats takeout any night of the week."
0,Liberal low-carb breakfast with fried eggs & yogurt - Recipe - Diet Doctor,"How do you take a moderate low-carb meal and make it a liberal low-carb meal? Just add a bowl of yogurt, blueberries, and walnuts to your breakfast of eggs, spinach, tomatoes, and avocado. With 26 grams of net carbs, this healthy simple breakfast is still well below the carb count of most…"
